{"schemaVersion":"harmonic-orrery.d-tier-taxonomy-dataset.v1","datasetId":"D_TIER_TAXONOMY_DATASET_v1","authorityBoundary":"planning_evidence","authorityNote":"D-tier fifth-space values are descriptive planning evidence. The census verdict does not govern whether valid data is available.","taxonomyBinding":{"artifact":"orrery/src/generated/taxonomy-read-model.v1.json","bundleFingerprint":"a235baba7c44b2cf28c3e97e605c51ec455fecc28c423e9c3722adf2e91d3002","canonicalLedgerSha256":"e6570972260fdae5c4ca878272dc89a9ff353d48762eefbe019707d229cd242d"},"censusBinding":{"artifact":"canonical/fivefold-incubator/fifth-space-census-v0.json","sha256":"ca4a5a46c768189ae08cbd96279aab580c2e6cc66dfd822bebeddbdc6c31b5eb","candidateId":"FIFTH_SPACE_CENSUS_v0","candidateFingerprint":"3234257c2f73335bc46df876a6e3c0d5a1871bec52d851b634a910b50f270048","status":"planning_evidence","researchVerdict":{"a2AnchorsAtCeiling":true,"ceilingRespected":true,"d7AnchorsAtCeiling":true,"derivation":"computed spans over the census records: no state exceeds span 10; all seven 7-33 A2 anchors and all seven 7-1 D7 anchors attain span 10 (gap multiset with maximum gap 2)","question":"Do all 462 states respect the geometric fifth-span ceiling of 10, with the 7-33 (A2) and 7-1 (D7) anchor families sitting at the ceiling?","questionId":"FSC-RQ-001","verdict":"confirmed"}},"recordCount":175,"records":[{"stateId":127,"sourceOrder":127,"name":"7-1 terminal cluster state 127","forte":"7-1","role":"anchor","tier":"D7","office":"Jupiter","officeStatus":"available","authority":"planning_evidence","fifthMask":2773,"fifthPositions":[0,2,4,6,7,9,11],"fifthSpan":10,"fifthArc":"[2,0]","holes":4,"gapMultiset":[1,1,2,2,2,2,2],"provenancePath":"canonical/universal-heptatonic-ledger.json"},{"stateId":191,"sourceOrder":191,"name":"Ultra-Alt 67","forte":"7-2","role":"satellite","tier":"D6","office":"Jupiter","officeStatus":"available","authority":"planning_evidence","fifthMask":2711,"fifthPositions":[0,1,2,4,7,9,11],"fifthSpan":9,"fifthArc":"[7,4]","holes":3,"gapMultiset":[1,1,1,2,2,2,3],"provenancePath":"canonical/universal-heptatonic-ledger.json"},{"stateId":253,"sourceOrder":253,"name":"Alt ♮25♭67","forte":"7-2","role":"satellite","tier":"D6","office":"Jupiter","officeStatus":"available","authority":"planning_evidence","fifthMask":2647,"fifthPositions":[0,1,2,4,6,9,11],"fifthSpan":9,"fifthArc":"[9,6]","holes":3,"gapMultiset":[1,1,1,2,2,2,3],"provenancePath":"canonical/universal-heptatonic-ledger.json"},{"stateId":375,"sourceOrder":375,"name":"Scale 375","forte":"7-13","role":"satellite","tier":"D4","office":"Venus","officeStatus":"available","authority":"planning_evidence","fifthMask":2517,"fifthPositions":[0,2,4,6,7,8,11],"fifthSpan":9,"fifthArc":"[11,8]","holes":3,"gapMultiset":[1,1,1,2,2,2,3],"provenancePath":"canonical/universal-heptatonic-ledger.json"},{"stateId":379,"sourceOrder":379,"name":"Kaikian Mode II","forte":"7-11","role":"satellite","tier":"D3","office":"Jupiter","officeStatus":"available","authority":"planning_evidence","fifthMask":3025,"fifthPositions":[0,4,6,7,8,9,11],"fifthSpan":8,"fifthArc":"[4,0]","holes":2,"gapMultiset":[1,1,1,1,2,2,4],"provenancePath":"canonical/universal-heptatonic-ledger.json"},{"stateId":381,"sourceOrder":381,"name":"Alt ♮25♭67","forte":"7-8","role":"anchor","tier":"D6","office":"Jupiter","officeStatus":"available","authority":"planning_evidence","fifthMask":2901,"fifthPositions":[0,2,4,6,8,9,11],"fifthSpan":10,"fifthArc":"[2,0]","holes":4,"gapMultiset":[1,1,2,2,2,2,2],"provenancePath":"canonical/universal-heptatonic-ledger.json"},{"stateId":415,"sourceOrder":415,"name":"Infra-Alt 57","forte":"7-6","role":"satellite","tier":"D5","office":"Saturn","officeStatus":"available","authority":"planning_evidence","fifthMask":919,"fifthPositions":[0,1,2,4,7,8,9],"fifthSpan":9,"fifthArc":"[7,4]","holes":3,"gapMultiset":[1,1,1,1,2,3,3],"provenancePath":"canonical/universal-heptatonic-ledger.json"},{"stateId":439,"sourceOrder":439,"name":"Infra-Alt 7♭4","forte":"7-Z38","role":"satellite","tier":"D2","office":"Jupiter","officeStatus":"available","authority":"planning_evidence","fifthMask":2455,"fifthPositions":[0,1,2,4,7,8,11],"fifthSpan":9,"fifthArc":"[7,4]","holes":3,"gapMultiset":[1,1,1,1,2,3,3],"provenancePath":"canonical/universal-heptatonic-ledger.json"},{"stateId":443,"sourceOrder":443,"name":"Alt ♭♭5♭♭6♭♭♭7","forte":"7-Z37","role":"anchor","tier":"D3","office":"Jupiter","officeStatus":"available","authority":"planning_evidence","fifthMask":2963,"fifthPositions":[0,1,4,7,8,9,11],"fifthSpan":9,"fifthArc":"[4,1]","holes":3,"gapMultiset":[1,1,1,1,2,3,3],"provenancePath":"canonical/universal-heptatonic-ledger.json"},{"stateId":445,"sourceOrder":445,"name":"Alt ♮2♭♭5♭6♭♭♭7","forte":"7-11","role":"satellite","tier":"D3","office":"Jupiter","officeStatus":"available","authority":"planning_evidence","fifthMask":2839,"fifthPositions":[0,1,2,4,8,9,11],"fifthSpan":8,"fifthArc":"[8,4]","holes":2,"gapMultiset":[1,1,1,1,2,2,4],"provenancePath":"canonical/universal-heptatonic-ledger.json"},{"stateId":463,"sourceOrder":463,"name":"Scale 463","forte":"7-7","role":"satellite","tier":"D2","office":"Jupiter","officeStatus":"available","authority":"planning_evidence","fifthMask":967,"fifthPositions":[0,1,2,6,7,8,9],"fifthSpan":8,"fifthArc":"[6,2]","holes":2,"gapMultiset":[1,1,1,1,1,3,4],"provenancePath":"canonical/universal-heptatonic-ledger.json"},{"stateId":471,"sourceOrder":471,"name":"Alt 3·6·♭7","forte":"7-15","role":"anchor","tier":"D2","office":"Jupiter","officeStatus":"available","authority":"planning_evidence","fifthMask":471,"fifthPositions":[0,1,2,4,6,7,8],"fifthSpan":8,"fifthArc":"[0,8]","holes":2,"gapMultiset":[1,1,1,1,2,2,4],"provenancePath":"canonical/universal-heptatonic-ledger.json"},{"stateId":475,"sourceOrder":475,"name":"Alt 6♭7","forte":"7-Z38","role":"satellite","tier":"D2","office":"Jupiter","officeStatus":"available","authority":"planning_evidence","fifthMask":979,"fifthPositions":[0,1,4,6,7,8,9],"fifthSpan":9,"fifthArc":"[4,1]","holes":3,"gapMultiset":[1,1,1,1,2,3,3],"provenancePath":"canonical/universal-heptatonic-ledger.json"},{"stateId":477,"sourceOrder":477,"name":"Alt ♮2𝄫6♭𝄫7","forte":"7-13","role":"satellite","tier":"D4","office":"Mercury","officeStatus":"available","authority":"planning_evidence","fifthMask":855,"fifthPositions":[0,1,2,4,6,8,9],"fifthSpan":9,"fifthArc":"[0,9]","holes":3,"gapMultiset":[1,1,1,2,2,2,3],"provenancePath":"canonical/universal-heptatonic-ledger.json"},{"stateId":487,"sourceOrder":487,"name":"Scale 487","forte":"7-7","role":"satellite","tier":"D2","office":"Jupiter","officeStatus":"available","authority":"planning_evidence","fifthMask":2503,"fifthPositions":[0,1,2,6,7,8,11],"fifthSpan":8,"fifthArc":"[6,2]","holes":2,"gapMultiset":[1,1,1,1,1,3,4],"provenancePath":"canonical/universal-heptatonic-ledger.json"},{"stateId":499,"sourceOrder":499,"name":"Major Locrian ♭26♭7","forte":"7-6","role":"satellite","tier":"D5","office":"Mars","officeStatus":"available","authority":"planning_evidence","fifthMask":2515,"fifthPositions":[0,1,4,6,7,8,11],"fifthSpan":9,"fifthArc":"[4,1]","holes":3,"gapMultiset":[1,1,1,1,2,3,3],"provenancePath":"canonical/universal-heptatonic-ledger.json"},{"stateId":607,"sourceOrder":607,"name":"Infra-Alt 56","forte":"7-10","role":"satellite","tier":"D5","office":"Saturn","officeStatus":"available","authority":"planning_evidence","fifthMask":733,"fifthPositions":[0,2,3,4,6,7,9],"fifthSpan":9,"fifthArc":"[0,9]","holes":3,"gapMultiset":[1,1,1,2,2,2,3],"provenancePath":"canonical/universal-heptatonic-ledger.json"},{"stateId":623,"sourceOrder":623,"name":"Infra-Alt 6","forte":"7-16","role":"satellite","tier":"D4","office":"Venus","officeStatus":"available","authority":"planning_evidence","fifthMask":2765,"fifthPositions":[0,2,3,6,7,9,11],"fifthSpan":9,"fifthArc":"[6,3]","holes":3,"gapMultiset":[1,1,1,2,2,2,3],"provenancePath":"canonical/universal-heptatonic-ledger.json"},{"stateId":631,"sourceOrder":631,"name":"Infra-Alt 6♭4","forte":"7-Z17","role":"anchor","tier":"D4","office":"Venus","officeStatus":"available","authority":"planning_evidence","fifthMask":2269,"fifthPositions":[0,2,3,4,6,7,11],"fifthSpan":8,"fifthArc":"[11,7]","holes":2,"gapMultiset":[1,1,1,1,2,2,4],"provenancePath":"canonical/universal-heptatonic-ledger.json"},{"stateId":635,"sourceOrder":635,"name":"Scale 635","forte":"7-16","role":"satellite","tier":"D4","office":"Venus","officeStatus":"available","authority":"planning_evidence","fifthMask":2777,"fifthPositions":[0,3,4,6,7,9,11],"fifthSpan":9,"fifthArc":"[3,0]","holes":3,"gapMultiset":[1,1,1,2,2,2,3],"provenancePath":"canonical/universal-heptatonic-ledger.json"},{"stateId":637,"sourceOrder":637,"name":"Debussy's Heptatonic","forte":"7-10","role":"satellite","tier":"D5","office":"Jupiter","officeStatus":"available","authority":"planning_evidence","fifthMask":2653,"fifthPositions":[0,2,3,4,6,9,11],"fifthSpan":9,"fifthArc":"[9,6]","holes":3,"gapMultiset":[1,1,1,2,2,2,3],"provenancePath":"canonical/universal-heptatonic-ledger.json"},{"stateId":671,"sourceOrder":671,"name":"Infra-Alt 5","forte":"7-Z12","role":"anchor","tier":"D5","office":"Saturn","officeStatus":"available","authority":"planning_evidence","fifthMask":671,"fifthPositions":[0,1,2,3,4,7,9],"fifthSpan":9,"fifthArc":"[7,4]","holes":3,"gapMultiset":[1,1,1,1,2,3,3],"provenancePath":"canonical/universal-heptatonic-ledger.json"},{"stateId":743,"sourceOrder":743,"name":"Phrygian Hungarian Minor","forte":"7-20","role":"satellite","tier":"D1","office":"Moon","officeStatus":"available","authority":"planning_evidence","fifthMask":2255,"fifthPositions":[0,1,2,3,6,7,11],"fifthSpan":8,"fifthArc":"[11,7]","holes":2,"gapMultiset":[1,1,1,1,1,3,4],"provenancePath":"canonical/universal-heptatonic-ledger.json"},{"stateId":761,"sourceOrder":761,"name":"Major Locrian ♯267","forte":"7-10","role":"satellite","tier":"D5","office":"Jupiter","officeStatus":"available","authority":"planning_evidence","fifthMask":2651,"fifthPositions":[0